{
  "candidate_id": "HIT-CAND-C1-MOBLEY-WORKDAY",
  "protocol_id": "HIT-IRP-HIT040-002",
  "slot": "evidence-limited",
  "public_case_name": "Mobley v. Workday",
  "institutional_unit": "Employer applicant-screening processes using Workday algorithmic tools as described in the public litigation record",
  "decision_process": "Applicant screening, recommendation, or rejection functions alleged in the pleadings and court record",
  "system_role": "Algorithmic tools alleged to perform or support applicant-screening functions for customer employers",
  "decision_status": "pending_human_selection",
  "packet_id": null,
  "expected_findings_recorded": false,
  "sources": [
    {
      "source_id": "C-S01",
      "title": "EEOC amicus materials in Mobley v. Workday, Inc., No. 3:23-cv-00770",
      "canonical_location": "https://www.eeoc.gov/litigation/briefs/mobley-v-workday-inc",
      "source_status": "identified_not_audited",
      "human_audit_required": true,
      "publisher_or_authority": null,
      "publication_or_filing_date": null,
      "source_function": null,
      "procedural_posture": null,
      "stable_locator_quality": null,
      "archive_status": "not_checked",
      "redistribution_status": "not_checked",
      "sha256": null,
      "human_notes": null
    }
  ],
  "audit_fields": {
    "actor_boundary_stability": null,
    "source_accessibility": null,
    "locator_precision": null,
    "procedural_posture_clarity": null,
    "archive_feasibility": null,
    "redistribution_feasibility": null,
    "repair_trigger_evidence": null,
    "contamination_risk": null,
    "packet_burden": null,
    "selection_eligibility": null
  },
  "human_decision": {
    "decision": "pending",
    "rationale": null,
    "decided_by": null,
    "decided_at": null
  }
}
