{
  "candidate_id": "HIT-CAND-C2-EPIC-SEPSIS",
  "protocol_id": "HIT-IRP-HIT040-002",
  "slot": "evidence-limited",
  "public_case_name": "Epic Sepsis Model at Michigan Medicine",
  "institutional_unit": "Michigan Medicine operational paging workflow using the Epic Sepsis Model during the published evaluation period",
  "decision_process": "Clinical paging and response workflow triggered by a proprietary sepsis risk score",
  "system_role": "Proprietary risk score and alert threshold used to generate clinician pages",
  "decision_status": "pending_human_selection",
  "packet_id": null,
  "expected_findings_recorded": false,
  "sources": [
    {
      "source_id": "C-S01",
      "title": "External Validation of a Widely Implemented Proprietary Sepsis Prediction Model in Hospitalized Patients",
      "canonical_location": "https://jamanetwork.com/journals/jamainternalmedicine/fullarticle/2781307",
      "source_status": "identified_not_audited",
      "human_audit_required": true,
      "publisher_or_authority": null,
      "publication_or_filing_date": null,
      "source_function": null,
      "procedural_posture": null,
      "stable_locator_quality": null,
      "archive_status": "not_checked",
      "redistribution_status": "not_checked",
      "sha256": null,
      "human_notes": null
    }
  ],
  "audit_fields": {
    "actor_boundary_stability": null,
    "source_accessibility": null,
    "locator_precision": null,
    "procedural_posture_clarity": null,
    "archive_feasibility": null,
    "redistribution_feasibility": null,
    "repair_trigger_evidence": null,
    "contamination_risk": null,
    "packet_burden": null,
    "selection_eligibility": null
  },
  "human_decision": {
    "decision": "pending",
    "rationale": null,
    "decided_by": null,
    "decided_at": null
  }
}
