{
  "candidate_id": "HIT-CAND-A1-DUKE-SEPSIS",
  "protocol_id": "HIT-IRP-HIT040-002",
  "slot": "exercise-rich",
  "public_case_name": "Duke Sepsis Watch",
  "institutional_unit": "Duke University Hospital emergency-department sepsis workflow",
  "decision_process": "Clinical response to machine-learning sepsis surveillance alerts",
  "system_role": "Machine-learning surveillance of EHR variables and routing of alerts to a rapid-response team",
  "decision_status": "pending_human_selection",
  "packet_id": null,
  "expected_findings_recorded": false,
  "sources": [
    {
      "source_id": "C-S01",
      "title": "Implementation and Evaluations of Sepsis Watch",
      "canonical_location": "https://clinicaltrials.gov/study/NCT03655626",
      "source_status": "identified_not_audited",
      "human_audit_required": true,
      "publisher_or_authority": null,
      "publication_or_filing_date": null,
      "source_function": null,
      "procedural_posture": null,
      "stable_locator_quality": null,
      "archive_status": "not_checked",
      "redistribution_status": "not_checked",
      "sha256": null,
      "human_notes": null
    },
    {
      "source_id": "C-S02",
      "title": "Real-World Integration of a Sepsis Deep Learning Technology Into Routine Clinical Care",
      "canonical_location": "https://pmc.ncbi.nlm.nih.gov/articles/PMC7391165/",
      "source_status": "identified_not_audited",
      "human_audit_required": true,
      "publisher_or_authority": null,
      "publication_or_filing_date": null,
      "source_function": null,
      "procedural_posture": null,
      "stable_locator_quality": null,
      "archive_status": "not_checked",
      "redistribution_status": "not_checked",
      "sha256": null,
      "human_notes": null
    },
    {
      "source_id": "C-S03",
      "title": "Integrating a Machine Learning System Into Clinical Workflows: Qualitative Study",
      "canonical_location": "https://pmc.ncbi.nlm.nih.gov/articles/PMC7714645/",
      "source_status": "identified_not_audited",
      "human_audit_required": true,
      "publisher_or_authority": null,
      "publication_or_filing_date": null,
      "source_function": null,
      "procedural_posture": null,
      "stable_locator_quality": null,
      "archive_status": "not_checked",
      "redistribution_status": "not_checked",
      "sha256": null,
      "human_notes": null
    },
    {
      "source_id": "C-S04",
      "title": "Duke’s Augmented Intelligence System Helps Prevent Sepsis in the ED",
      "canonical_location": "https://physicians.dukehealth.org/articles/dukes-augmented-intelligence-system-helps-prevent-sepsis-ed",
      "source_status": "identified_not_audited",
      "human_audit_required": true,
      "publisher_or_authority": null,
      "publication_or_filing_date": null,
      "source_function": null,
      "procedural_posture": null,
      "stable_locator_quality": null,
      "archive_status": "not_checked",
      "redistribution_status": "not_checked",
      "sha256": null,
      "human_notes": null
    }
  ],
  "audit_fields": {
    "actor_boundary_stability": null,
    "source_accessibility": null,
    "locator_precision": null,
    "procedural_posture_clarity": null,
    "archive_feasibility": null,
    "redistribution_feasibility": null,
    "repair_trigger_evidence": null,
    "contamination_risk": null,
    "packet_burden": null,
    "selection_eligibility": null
  },
  "human_decision": {
    "decision": "pending",
    "rationale": null,
    "decided_by": null,
    "decided_at": null
  }
}
